### ISSUE TITLE
Can't do just in time provisioning at AWS IoT, certificate contains CA

### ISSUE THREAD

**Issue by KirillSelyak** [chkr1011/MQTTnet#1079]
### Describe the bug
I'm trying to do just in time provisioning at AWS IoT by following this article [https://aws.amazon.com/blogs/iot/setting-up-just-in-time-provisioning-with-aws-iot-core/](https://aws.amazon.com/blogs/iot/setting-up-just-in-time-provisioning-with-aws-iot-core/)  
I can do it with external tools like [Mqtt explorer](http://mqtt-explorer.com/) but can't with MQTTNet package.
### Which project is your bug related to?

- MQTTnet nuget package 3.0.13

### To Reproduce
1. Having AWS IoT instance
2. Create and register own CA by following steps from here - https://aws.amazon.com/blogs/iot/setting-up-just-in-time-provisioning-with-aws-iot-core/
3. Create private key and certificate issued from the CA earlier registered at AWS IoT by using openssl
4. REMARK. By using mqtt explorer I can do provisioning, just need to send CA together with certificate.
 To accomplish that need to create a file that contains certificate and CA. 
 Use this bash command: `cat cert.pem ca.pem > certAndCA.pem`.
 Use this file as a certificate to establish mqtt connection. 
 Everything works fine.
4. To to the same in .net code need to create pfx certificate that contains certificate, CA and private key.
Use this command: `openssl pkcs12 -export -out certAndCA.pfx -inkey keyfile.pem -in cert.pem -certfile ca.pem`
5. Try to connect. 
App fails with a timeout. Trace logs contains next warning `Timeout while waiting for packet of type 'MqttConnAckPacket'`

### Expected behavior
I guess it should work. Not sure where the issue is.
I tried different approaches. 
For example, created pfx certificate that contains only certificate and private key and added separately ca certificate. No luck

### Additional context / logging
Include debugging or logging information here:

```batch
>> [2021-02-01T20:54:00.0348183Z] [1] [MqttClient] [Verbose]: Trying to connect with server '{aws_iot}.amazonaws.com:8883' (Timeout=00:00:10).
>> [2021-02-01T20:54:00.8481910Z] [7] [MqttClient] [Verbose]: Connection with server established.
>> [2021-02-01T20:54:00.8738003Z] [5] [MqttClient] [Verbose]: Start receiving packets.
>> [2021-02-01T20:54:00.9222467Z] [7] [MqttChannelAdapter] [Verbose]: TX (26 bytes) >>> Connect: [ClientId=uniqueclient] [Username=] [Password=] [KeepAlivePeriod=60] [CleanSession=True]
>> [2021-02-01T20:54:00.9987905Z] [7] [MqttClient] [Verbose]: Disconnecting [Timeout=00:00:10]
>> [2021-02-01T20:54:01.0036639Z] [7] [MqttClient] [Verbose]: Disconnected from adapter.
>> [2021-02-01T20:54:01.0073583Z] [7] [MqttClient] [Info]: Disconnected.
>> [2021-02-01T20:54:01.0077173Z] [7] [MqttClient] [Verbose]: Stopped receiving packets.
>> [2021-02-01T20:54:10.9412866Z] [4] [MqttClient] [Warning]: Timeout while waiting for packet of type 'MqttConnAckPacket'.
>> [2021-02-01T20:54:10.9473162Z] [4] [MqttClient] [Error]: Error while connecting with server.
MQTTnet.Exceptions.MqttCommunicationTimedOutException: Exception of type 'MQTTnet.Exceptions.MqttCommunicationTimedOutException' was thrown.
   at MQTTnet.PacketDispatcher.MqttPacketAwaiter`1.WaitOneAsync(TimeSpan timeout)
   at MQTTnet.Client.MqttClient.SendAndReceiveAsync[TResponsePacket](MqttBasePacket requestPacket, CancellationToken cancellationToken)
   at MQTTnet.Client.MqttClient.AuthenticateAsync(IMqttChannelAdapter channelAdapter, MqttApplicationMessage willApplicationMessage, CancellationToken cancellationToken)
   at MQTTnet.Client.MqttClient.ConnectAsync(IMqttClientOptions options, CancellationToken cancellationToken)

```

Wireshark logs shows that server sent and Encrypted Alert
```batch
68	8.316424	192.168.0.103	13.48.179.113	TCP	66	1506 → 8883 [SYN] Seq=0 Win=65535 Len=0 MSS=1460 WS=2 SACK_PERM=1
69	8.362340	13.48.179.113	192.168.0.103	TCP	66	8883 → 1506 [SYN, ACK] Seq=0 Ack=1 Win=26883 Len=0 MSS=1460 SACK_PERM=1 WS=256
70	8.362634	192.168.0.103	13.48.179.113	TCP	54	1506 → 8883 [ACK] Seq=1 Ack=1 Win=65536 Len=0
71	8.477410	192.168.0.103	13.48.179.113	TLSv1.2	263	Client Hello
73	8.523059	13.48.179.113	192.168.0.103	TCP	54	8883 → 1506 [ACK] Seq=1 Ack=210 Win=28160 Len=0
74	8.523588	13.48.179.113	192.168.0.103	TLSv1.2	150	Server Hello
75	8.523708	13.48.179.113	192.168.0.103	TCP	1514	8883 → 1506 [ACK] Seq=97 Ack=210 Win=28160 Len=1460 [TCP segment of a reassembled PDU]
76	8.523759	192.168.0.103	13.48.179.113	TCP	54	1506 → 8883 [ACK] Seq=210 Ack=1557 Win=65536 Len=0
77	8.524372	13.48.179.113	192.168.0.103	TCP	2974	8883 → 1506 [ACK] Seq=1557 Ack=210 Win=28160 Len=2920 [TCP segment of a reassembled PDU]
78	8.524372	13.48.179.113	192.168.0.103	TLSv1.2	565	Certificate
79	8.524435	192.168.0.103	13.48.179.113	TCP	54	1506 → 8883 [ACK] Seq=210 Ack=4988 Win=65536 Len=0
80	8.524500	13.48.179.113	192.168.0.103	TLSv1.2	438	Server Key Exchange, Certificate Request, Server Hello Done
81	8.524523	192.168.0.103	13.48.179.113	TCP	54	1506 → 8883 [ACK] Seq=210 Ack=5372 Win=65152 Len=0
83	8.571575	192.168.0.103	13.48.179.113	TLSv1.2	1309	Certificate, Client Key Exchange, Certificate Verify, Change Cipher Spec, Encrypted Handshake Message
84	8.618627	13.48.179.113	192.168.0.103	TLSv1.2	105	Change Cipher Spec, Encrypted Handshake Message
85	8.659562	192.168.0.103	13.48.179.113	TCP	54	1506 → 8883 [ACK] Seq=1465 Ack=5423 Win=65100 Len=0
86	8.721786	192.168.0.103	13.48.179.113	TLSv1.2	109	Application Data
87	8.777379	13.48.179.113	192.168.0.103	TLSv1.2	85	Encrypted Alert
88	8.796676	192.168.0.103	13.48.179.113	TCP	54	1506 → 8883 [FIN, ACK] Seq=1520 Ack=5454 Win=65070 Len=0
89	8.843021	13.48.179.113	192.168.0.103	TCP	54	8883 → 1506 [FIN, ACK] Seq=5454 Ack=1521 Win=30720 Len=0
90	8.843313	192.168.0.103	13.48.179.113	TCP	54	1506 → 8883 [ACK] Seq=1521 Ack=5455 Win=65070 Len=0
```

### Code example
 Please provide full code examples below where possible to make it easier for the developers to check your issues.
 
```csharp
using System;
using System.Security.Authentication;
using System.Security.Cryptography.X509Certificates;
using System.Threading.Tasks;
using MQTTnet.Client;
using MQTTnet.Client.Options;
using MQTTnet.Diagnostics;

namespace MQTTnet.Spike
{
    class Program
    {
        static async Task Main(string[] args)
        {
            TraceInternalLogsToConsole();
            IMqttClientOptions options = CreateOptions();
            IMqttClient client = new MqttFactory()
                .CreateMqttClient();

            await client.ConnectAsync(options);

            Console.WriteLine("Connected!");
            Console.WriteLine("Press any key to exit");
            Console.ReadKey();
        }

        private static IMqttClientOptions CreateOptions()
        {
            var certAndCaPfx = new X509Certificate2(
                @"..\certAndCA.pfx",
                string.Empty,
                X509KeyStorageFlags.PersistKeySet | X509KeyStorageFlags.Exportable);
            var result = new MqttClientOptionsBuilder()
                .WithCleanSession()
                .WithClientId("anyId")
                .WithKeepAlivePeriod(TimeSpan.FromSeconds(60))
                .WithTcpServer("{aws_iot}.amazonaws.com", 8883)
                .WithTls(new MqttClientOptionsBuilderTlsParameters
                {
                    UseTls = true,
                    SslProtocol = SslProtocols.Tls12,
                    Certificates = new[] { certAndCaPfx },
                    IgnoreCertificateChainErrors = true,
                    IgnoreCertificateRevocationErrors = true,
                    AllowUntrustedCertificates = true,
                    CertificateValidationHandler = context => true
                }).Build();
            return result;

        }

        private static void TraceInternalLogsToConsole()
        {
            MqttNetGlobalLogger.LogMessagePublished += (s, e) =>
            {
                var trace = $">> [{e.TraceMessage.Timestamp:O}] [{e.TraceMessage.ThreadId}] [{e.TraceMessage.Source}] [{e.TraceMessage.Level}]: {e.TraceMessage.Message}";
                if (e.TraceMessage.Exception != null)
                {
                    trace += Environment.NewLine + e.TraceMessage.Exception.ToString();
                }
                Console.WriteLine(trace);
            };
        }
    }
}

```

**Comment by KirillSelyak** [comment]
Eventually I figured out a reason: connection failed when client sends mqtt connect message - http://docs.oasis-open.org/mqtt/mqtt/v3.1.1/os/mqtt-v3.1.1-os.html#_Toc398718028 
AWS considers it improperly formed. To bypass it need to use mqtt protocol version V500.
In this case Mqtt connection will be established. After that AWS will terminate this connection and start doing provisioning.

Provisioning takes 1-2 seconds.
After that we could connect to AWS by using mqtt protocol version V311.

Not sure where the issue is. Most likely somewhere on AWS side.
MQTTnet works fine with AWS in general. For example. when you create certificate at AWS IoT no issues at all.

**Comment by KirillSelyak** [comment]
What could be improved it is error handling. 
Would be nice if the client gets disconnected as earlier as possible rather than waiting and gets disconnected by timeout.
Moreover clients knows that it is disconnected and stopped receiving packets, see MQTTnet output, 9 seconds delay:
```
>> [2021-02-01T20:54:01.0036639Z] [7] [MqttClient] [Verbose]: Disconnected from adapter.
>> [2021-02-01T20:54:01.0073583Z] [7] [MqttClient] [Info]: Disconnected.
>> [2021-02-01T20:54:01.0077173Z] [7] [MqttClient] [Verbose]: Stopped receiving packets.
>> [2021-02-01T20:54:10.9412866Z] [4] [MqttClient] [Warning]: Timeout while waiting for packet of type 
```

Looks like there is missed synchronization for async operations: "disconnected from ssl stream" and " mqtt connect".

**Comment by albert-t25** [comment]
I have the exact same issue. @KirillSelyak were you able to solve it?

**Comment by KirillSelyak** [comment]
@albert-t25 , yep )))
MQTTNet  is fine, error notifications could be improved. That is another story. 

The same issue could be reproduced with pure SslStream.
In this case wire shark shows that client doesn't send CA at all.
Here are few issues that I see.
1) .net has a bit confusing signature, it gets a list of certificates as incoming parameters.
  This signature creates impression that all of them will be send. But it is not so.   
  Instead .net will send certificates chain of each certificate.  
  Make a note that entire chain should be registered in certificates store.
2) Client could don't sent root CA because it is optional according to TLS spec.
   .net or windows doesn't send CA which sounds reasonable.
 
To solve it need to have next certificate chain:
1) Root CA => intermediate certificate => device certificate
2) Register  Root CA and intermediate certificate in windows store
3) register intermediate certificate in AWS IoT as custom CA.
That should work.

I checked how it works in Windows. Unix system might act a bit differently, they manage certificates another way. 
The concept should be same.

**Comment by albert-t25** [comment]
Thank you @KirillSelyak. I tried to connect using openssl, running
`openssl s_client -CAfile awsca.pem -cert xxx.pem.crt -key xxx.pem.key -connect yyy.iot.us-east-2.amazonaws.com:8883`
and connected successfully. Reply includes the following:

```
CONNECTED(000001E4)
depth=2 C = US, O = Amazon, CN = Amazon Root CA 1
verify return:1
depth=1 C = US, O = Amazon, OU = Server CA 1B, CN = Amazon
verify return:1
depth=0 CN = *.iot.us-east-2.amazonaws.com
verify return:1
---
Certificate chain
 0 s:/CN=*.iot.us-east-2.amazonaws.com
   i:/C=US/O=Amazon/OU=Server CA 1B/CN=Amazon
 1 s:/C=US/O=Amazon/OU=Server CA 1B/CN=Amazon
   i:/C=US/O=Amazon/CN=Amazon Root CA 1
 2 s:/C=US/O=Amazon/CN=Amazon Root CA 1
   i:/C=US/ST=Arizona/L=Scottsdale/O=Starfield Technologies, Inc./CN=Starfield Services Root Certificate Authority - G2
 3 s:/C=US/ST=Arizona/L=Scottsdale/O=Starfield Technologies, Inc./CN=Starfield Services Root Certificate Authority - G2
   i:/C=US/O=Starfield Technologies, Inc./OU=Starfield Class 2 Certification Authority
```

Currently I'm sending both certificates as specified below:

```
                var tlsParameters = new MqttClientOptionsBuilderTlsParameters
                {
                    UseTls = true,
                    Certificates = new[] { new X509Certificate(Certificate.Export(X509ContentType.Pfx)), new X509Certificate(RootCertificate.Export(X509ContentType.Cert)) },
                    IgnoreCertificateRevocationErrors = true, //Prevent online revocation check
                    IgnoreCertificateChainErrors = true,
                    AllowUntrustedCertificates = true,
                    SslProtocol = System.Security.Authentication.SslProtocols.Tls12
                };
```

Based on the logs, there's an intermediate certificate `depth=1 C = US, O = Amazon, OU = Server CA 1B, CN = Amazon` that I need to either send explicitly from the code or register it in AWS as custom CA. Is that right?

I can't rely on Windows Store since the app will run from a Rasperry Pi device.

**Comment by KirillSelyak** [comment]
@albert-t25 , openssl doesn’t show , help much because it is for tls not for mqtt. 
Seems there is no issue with tls connection itself. It is established even with mqttnet.
The issue is at mqtt connect, during sending CONNACK message.  As far as I remember AWS validates certificates chain at this moment and  see that client didn’t send CA and terminates the connection. 
At least it is a reasonable argument for me why AWS IoT established tls connection and fails at Mqtt connect.

I would propose you to check how .net works with certificates on Raspberry PI platform. It might have own implementation of store.

**Comment by KirillSelyak** [comment]
@albert-t25 , seems openssl works in straightforward manner and send what you provide. Certificate, Ca and bypass platform specifics. 
meanwhile .net rely on platform and try to be compliant with the way how certificates are managed there.

**Comment by albert-t25** [comment]
Thank you @KirillSelyak . Mi thinking is to try and pass the intermediate certificate as part of the options

```
                var tlsParameters = new MqttClientOptionsBuilderTlsParameters
                {
                    UseTls = true,
                    Certificates = new[] { Certificate, **IntermediateCa**, RootCertificate },
                    IgnoreCertificateRevocationErrors = false, //Prevent online revocation check
                    IgnoreCertificateChainErrors = false,
                    AllowUntrustedCertificates = false,
                    SslProtocol = System.Security.Authentication.SslProtocols.Tls12
                };
```

I'm not sure if it will work, but seems worth a try.

**Comment by albert-t25** [comment]
For anyone running into similar issues. Make sure you're not doing any silly mistake. In my case I was trying to connect to xxx.iot.us-east-2.amazonaws.com instead of xxx.iot.us-east-1.amazonaws.com (must have copied it while being in another region). So before digging dip on certificates, make sure:

- you have the correct URL. Copy it from "Interact" section of the "thing"
- you can connect to that URL using openssl (running `openssl s_client -CAfile awsca.pem -cert xxx.pem.crt -key xxx.pem.key -connect yyy.iot.region.amazonaws.com:8883`)
- certificate attached to the thing is activated
- you have attached one policy (or several) that allows the thing to connect, subscribe, publish and receive

If you're absolutely sure of the above, then start troubleshooting certificates

**Comment by SeppPenner** [comment]
I have added your troubleshooting tips to https://github.com/chkr1011/MQTTnet/wiki/Client#troubleshooting, @albert-t25 ;)
